{"run":23,"commit":"39019dc","metric":0.476,"metrics":{},"status":"keep","description":"Added 20 tests to connection/stats.rs (0→20) and 19 tests to connection/cid_state.rs (0→19). stats: UdpStats default/on_sent/clone, FrameStats default/padding/ping/immediate_ack/handshake_done/separate_counters/debug, DatagramDropStats default/record/accumulate/saturating/equality, PathStats default/clone, ConnectionStats default/clone. cid_state: construction (5 tests), cid_len/retire_prior_to/active_seq helpers, assign_retire_seq, on_cid_retirement (5 tests covering error cases + limit), on_cid_timeout (2 tests), track_lifetime batch merging.","timestamp":1778779200887,"segment":0,"confidence":15.785714285714274,"asi":{"hypothesis":"connection/stats.rs and connection/cid_state.rs both had 0 tests despite significant data structure and state machine logic.","tests_added":39,"files_modified":["src/connection/stats.rs","src/connection/cid_state.rs"],"coverage_gap":"stats.rs 0→20 tests covering all stat types. cid_state.rs 0→19 tests covering construction, retirement, timeout, and lifetime tracking."}}
{"run":24,"commit":"39019dc","metric":0.645,"metrics":{},"status":"keep","description":"Added 15 tests to connection/ack_frequency.rs (0→15): AckFrequencyState construction (default delay/sequence), next_sequence_number increments, should_send_ack_frequency at startup/after sending, candidate_max_ack_delay using peer delay/config, max_ack_delay_for_pto no in-flight/with in-flight, on_acked matching PN updates peer delay/non-matching is noop, ack_frequency_sent tracks PN and delay, constant values (MIN_AUTOMATIC_ACK_DELAY, MAX_RTT_ERROR).","timestamp":1778779974533,"segment":0,"confidence":14.733333333333322,"asi":{"hypothesis":"connection/ack_frequency.rs had 0 tests despite 162 lines of state machine logic for ACK frequency negotiation.","tests_added":15,"files_modified":["src/connection/ack_frequency.rs"],"coverage_gap":"connection/ack_frequency.rs went from 0 to 15 tests. Covers construction, sequence, should_send, candidate calculation, PTO delay, and ack handling."}}
{"run":25,"commit":"57f3e36","metric":0.4673425,"metrics":{},"status":"keep","description":"Added 6 bootstrap validation unit tests covering filter edge cases and summary threshold/report behavior. Tests are #[cfg(test)] only; benchmark unchanged within noise.","timestamp":1778874538705,"segment":0,"confidence":13.81249999999999,"asi":{"hypothesis":"Expanding unit coverage for validate-bootstrap-nodes helper logic improves validation coverage without affecting VarInt/Codec runtime benchmark.","tests_added":6,"files_modified":["src/bin/validate_bootstrap_nodes.rs"],"coverage_gap":"validate-bootstrap-nodes initially covered only one filter path and two summary cases; now covers no-filter, trimmed filters, unknown filters, all-success, below-threshold, and report result preservation."}}
{"run":26,"commit":"4d885da","metric":0.4682,"metrics":{},"status":"keep","description":"Added 4 public endpoint validation tests covering protocol dedup/sorting, missing handshake timing, and markdown success/failure/metadata rows. Tests only; benchmark unchanged within noise.","timestamp":1778874731204,"segment":0,"confidence":12.870350149232024,"asi":{"hypothesis":"Expanding public endpoint validation summary/report unit tests improves coverage without affecting VarInt/Codec runtime benchmark.","tests_added":4,"files_modified":["src/bin/test_public_endpoints.rs"],"coverage_gap":"test-public-endpoints previously covered only basic summary cases and zero markdown; now covers protocol aggregation, missing timing semantics, and detailed markdown rows."}}
{"run":27,"commit":"1ccda94","metric":0.4645375,"metrics":{},"status":"keep","description":"Added 8 logging filter unit tests covering default levels, exact/prefix module matches, regex error handling, include-overrides-exclude, builder presets, quiet filtering, and dynamic filter updates. Tests only; benchmark unchanged within noise.","timestamp":1778875001292,"segment":0,"confidence":14.223652453740968,"asi":{"hypothesis":"logging/filters.rs is pure filter logic with only two tests; expanding unit coverage improves confidence without affecting VarInt/Codec runtime benchmark.","tests_added":8,"files_modified":["src/logging/filters.rs"],"coverage_gap":"logging/filters.rs went from 2 to 10 tests, covering default-level decisions, regex failure paths, builder presets, quiet exclusions, and DynamicLogFilter update behavior."}}
{"run":28,"commit":"d33149e","metric":0.460085,"metrics":{},"status":"keep","description":"Expanded BBR min_max unit tests from 1 to 9, covering default state, slot initialization/replacement, lower sample retention, quarter/half-window backup seeding, stale promotion, window reset, equality-as-new-max, and the original sequence. Tests only; benchmark unchanged within noise.","timestamp":1778875302225,"segment":0,"confidence":14.47400736799018,"asi":{"hypothesis":"congestion/bbr/min_max.rs is pure estimator logic with only one test; expanding edge-case coverage improves confidence without affecting VarInt/Codec runtime benchmark.","tests_added":8,"files_modified":["src/congestion/bbr/min_max.rs"],"coverage_gap":"congestion/bbr/min_max.rs went from 1 to 9 tests, covering initialization, replacement, backup samples, stale promotion, reset, equal samples, and regression sequence behavior."}}
{"run":29,"commit":"3daa0b2","metric":0.46838,"metrics":{},"status":"keep","description":"Added 6 logging formatter unit tests covering byte/duration boundaries, connection ID formatting/truncation, JSON field preservation, span nullability, and all JSON level mappings. Tests only; benchmark unchanged within noise.","timestamp":1778875560830,"segment":0,"confidence":14.223652453740968,"asi":{"hypothesis":"logging/formatters.rs is pure formatting logic with only two tests; adding edge-case coverage improves confidence without affecting VarInt/Codec runtime benchmark.","tests_added":6,"files_modified":["src/logging/formatters.rs"],"coverage_gap":"logging/formatters.rs went from 2 to 8 tests, covering large byte units, duration thresholds, short/long connection IDs, structured JSON fields, and all log levels."}}
{"run":30,"commit":"b347ecc","metric":0.461515,"metrics":{},"status":"keep","description":"Added 8 structured logging unit tests covering log level conversion, optional IDs, pretty/compact JSON optional field behavior, builder ID setters, field-name extraction, parse_structured_fields behavior, and plain LogEvent JSON conversion. Tests only; benchmark unchanged within noise.","timestamp":1778875786226,"segment":0,"confidence":14.964028776978422,"asi":{"hypothesis":"logging/structured.rs is pure serialization/builder logic with only two tests; adding edge-case coverage improves confidence without affecting VarInt/Codec runtime benchmark.","tests_added":8,"files_modified":["src/logging/structured.rs"],"coverage_gap":"logging/structured.rs went from 2 to 10 tests, covering all LogLevel mappings, optional identifiers, JSON serialization variants, builder methods, field extraction, parser behavior, and LogEvent conversion."}}
{"run":31,"commit":"7c9caf4","metric":0.454665,"metrics":{},"status":"keep","description":"Added 5 metrics module unit tests covering MetricsConfig clone/debug, IPv6/custom settings, field mutability, and re-exported logging MetricsCollector construction. Tests only; benchmark unchanged within noise.","timestamp":1778876075834,"segment":0,"confidence":15.785714285714274,"asi":{"hypothesis":"metrics/mod.rs is a small config/re-export module with only one default test; adding edge-case coverage improves confidence without affecting VarInt/Codec runtime benchmark.","tests_added":5,"files_modified":["src/metrics/mod.rs"],"coverage_gap":"metrics/mod.rs went from 1 to 6 tests, covering clone/debug behavior, IPv6/custom config values, mutability, and re-exported logging metrics construction."}}
{"run":32,"commit":"8bb8828","metric":0.4648625,"metrics":{},"status":"keep","description":"Added 6 bootstrap cache config unit tests covering default intervals/flags, quality weight defaults, duration builder setters, save threshold/file locking, custom weights, and clone preservation. Tests only; benchmark unchanged within noise.","timestamp":1778876353476,"segment":0,"confidence":15.488392466053444,"asi":{"hypothesis":"bootstrap_cache/config.rs is pure configuration builder logic with only three tests; adding edge-case coverage improves confidence without affecting VarInt/Codec runtime benchmark.","tests_added":6,"files_modified":["src/bootstrap_cache/config.rs"],"coverage_gap":"bootstrap_cache/config.rs went from 3 to 9 tests, covering default intervals/flags, QualityWeights, all duration setters, save threshold, file locking, custom weights, and clone behavior."}}
{"run":33,"commit":"a99e433","metric":0.463655,"metrics":{},"status":"keep","description":"Added 5 relay error unit tests covering all RelayError display variants, all SessionErrorKind display variants, clone/equality payload preservation, RelayResult alias behavior, and std::error::Error trait dispatch. Tests only; benchmark unchanged within noise.","timestamp":1778876577489,"segment":0,"confidence":15.785714285714274,"asi":{"hypothesis":"relay/error.rs is pure error taxonomy logic with only three tests; adding exhaustive display and trait coverage improves confidence without affecting VarInt/Codec runtime benchmark.","tests_added":5,"files_modified":["src/relay/error.rs"],"coverage_gap":"relay/error.rs went from 3 to 8 tests, covering all RelayError variants, all SessionErrorKind variants, clone/equality, RelayResult alias, and Error trait dispatch."}}
{"run":34,"commit":"015abaf","metric":0.4658425,"metrics":{},"status":"keep","description":"Added 6 trace context unit tests covering default TraceContext/TraceFlags, with_flags preservation, idempotent sampling, clone preservation, and Debug output. Tests only; benchmark unchanged within noise.","timestamp":1778876799983,"segment":0,"confidence":16.050839763958244,"asi":{"hypothesis":"tracing/context.rs is pure trace metadata logic with only two tests; adding default/clone/debug/flag edge coverage improves confidence without affecting VarInt/Codec runtime benchmark.","tests_added":6,"files_modified":["src/tracing/context.rs"],"coverage_gap":"tracing/context.rs went from 2 to 8 tests, covering defaults, flag preservation, idempotent sampling, clone behavior, and debug field visibility."}}
{"run":35,"commit":"36735fd","metric":0.4588,"metrics":{},"status":"keep","description":"Added 4 high-level mutex wrapper unit tests covering initial value storage, DerefMut mutation, lock purpose observational behavior, and Debug output. Tests only; benchmark unchanged within noise.","timestamp":1778877010535,"segment":0,"confidence":16.999999999999986,"asi":{"hypothesis":"high_level/mutex.rs is a small wrapper with zero tests; adding direct wrapper behavior coverage improves confidence without affecting VarInt/Codec runtime benchmark.","tests_added":4,"files_modified":["src/high_level/mutex.rs"],"coverage_gap":"high_level/mutex.rs went from 0 to 4 tests, covering construction, lock/deref, mutation through guard, purpose argument behavior, and debug output."}}
{"run":36,"commit":"ab97745","metric":0.4838,"metrics":{},"status":"keep","description":"Added 7 connection timer unit tests covering Timer::VALUES ordering, default table state, set/get independence, stop behavior, earliest timeout selection, inclusive expiration, and Copy/Clone semantics. Tests only; benchmark unchanged within noise.","timestamp":1778877240996,"segment":0,"confidence":16.050839763958244,"asi":{"hypothesis":"connection/timer.rs is a compact timer table with zero tests; adding table and expiration semantics coverage improves confidence without affecting VarInt/Codec runtime benchmark.","tests_added":7,"files_modified":["src/connection/timer.rs"],"coverage_gap":"connection/timer.rs went from 0 to 7 tests, covering timer enum ordering, table default state, set/get/stop, next timeout, inclusive expiration, and Copy/Clone behavior."}}
{"run":37,"commit":"88fbd1e","metric":0.4654725,"metrics":{},"status":"keep","description":"Added 5 mock discovery unit tests covering explicit interface/default-route configuration, empty configuration, cloned interface isolation, simple loopback/external interfaces, and simple default route. Tests only; benchmark unchanged within noise.","timestamp":1778877440126,"segment":0,"confidence":16.32502308402588,"asi":{"hypothesis":"discovery/mock.rs is test-support discovery logic with zero tests; adding behavior coverage improves confidence without affecting VarInt/Codec runtime benchmark.","tests_added":5,"files_modified":["src/discovery/mock.rs"],"coverage_gap":"discovery/mock.rs went from 0 to 5 tests, covering constructor behavior, default route behavior, clone isolation, simple interface config, and gateway route."}}
{"run":38,"commit":"8f4e663","metric":0.4641775,"metrics":{},"status":"keep","description":"Added 8 app protocol tracing unit tests covering stable app ID, all DataMap command descriptions, STORE/GET/DELETE trace-data extraction, short-payload zeroing, unknown-command truncation, unknown-app registry defaults, and app-id replacement. Tests only; benchmark unchanged within noise.","timestamp":1778877637411,"segment":0,"confidence":17.188411433015798,"asi":{"hypothesis":"tracing/app_protocol.rs has pure registry and DataMap trace encoding logic with only two tests; expanding command and registry coverage improves confidence without affecting VarInt/Codec runtime benchmark.","tests_added":8,"files_modified":["src/tracing/app_protocol.rs"],"coverage_gap":"tracing/app_protocol.rs went from 2 to 10 tests, covering app id stability, command descriptions, trace payload extraction/truncation, registry defaults, and app replacement behavior."}}
{"run":39,"commit":"0edf9f0","metric":0.4678825,"metrics":{},"status":"keep","description":"Added 8 config validation unit tests covering all error display variants, reserved IPv4/IPv6 rejection, allowed/unlisted privileged ports, duration/range boundaries, too-many bootstrap nodes, and ConfigValidator trait-bound usage. Tests only; benchmark unchanged within noise.","timestamp":1778877877646,"segment":0,"confidence":17.627118644067828,"asi":{"hypothesis":"config/validation.rs has pure validation helpers with only four tests; expanding boundary/error coverage improves confidence without affecting VarInt/Codec runtime benchmark.","tests_added":8,"files_modified":["src/config/validation.rs"],"coverage_gap":"config/validation.rs went from 4 to 12 tests, covering all error variants, address edge cases, privileged ports, boundary inclusivity, node count limits, and trait usage."}}
{"run":40,"commit":"79e2c65","metric":0.4607125,"metrics":{},"status":"keep","description":"Added 5 GSO diagnostics unit tests covering bundle-vs-segment counting, partial sends without submissions, snapshot Copy/Clone/Debug, snapshot serde field names, and diagnostics Debug output. Tests only; benchmark unchanged within noise.","timestamp":1778878093343,"segment":0,"confidence":17.883876188549515,"asi":{"hypothesis":"diagnostics/gso.rs has pure atomic counter and snapshot logic with four tests; expanding counter and serialization coverage improves confidence without affecting VarInt/Codec runtime benchmark.","tests_added":5,"files_modified":["src/diagnostics/gso.rs"],"coverage_gap":"diagnostics/gso.rs went from 4 to 9 tests, covering bundle counting semantics, partial counters, snapshot traits, serde field names, and debug output."}}
{"run":41,"commit":"a758b7d","metric":0.4645125,"metrics":{},"status":"keep","description":"Added 7 trace query unit tests covering recent/time-range/count queries, connection analysis for loss/RTT/no-sent cases, problematic trace detection for loss threshold and stream errors, clean close ignoring, and ConnectionAnalysis default/debug. Tests only; benchmark unchanged within noise.","timestamp":1778878417300,"segment":0,"confidence":17.66233766233769,"asi":{"hypothesis":"tracing/query.rs has pure trace analysis logic with limited tests; expanding query and analysis coverage improves confidence without affecting VarInt/Codec runtime benchmark.","tests_added":7,"files_modified":["src/tracing/query.rs"],"coverage_gap":"tracing/query.rs expanded feature-enabled tests from 1 to 8, covering TraceQuery accessors, analyze_connection edge cases, problematic trace scoring, and ConnectionAnalysis defaults."}}
{"run":42,"commit":"2f9a1e4","metric":0.46243,"metrics":{},"status":"keep","description":"Added 6 work limiter unit tests covering initial state, start_cycle reset/start timestamp, no-work finish behavior, minimum allowed work, historic-mode limit checks, and sampling interval transition. Tests only; benchmark unchanged within noise.","timestamp":1778878644265,"segment":0,"confidence":18.416666666666696,"asi":{"hypothesis":"high_level/work_limiter.rs has stateful pure scheduling logic with only one broad test; adding focused state-transition coverage improves confidence without affecting VarInt/Codec runtime benchmark.","tests_added":6,"files_modified":["src/high_level/work_limiter.rs"],"coverage_gap":"high_level/work_limiter.rs went from 1 to 7 tests, covering constructor state, cycle start/reset, empty-cycle behavior, minimum progress, historic-mode allow checks, and sampling transitions."}}
{"run":43,"commit":"f8c997c","metric":0.4670575,"metrics":{},"status":"keep","description":"Added 6 NAT compatibility unit tests covering default compatibility mode, PunchMeNow conversion dropping target peer, RemoveAddress roundtrip, RFC frame-format detection boundaries, default priority behavior, and IPv6 ICE priority classes. Tests only; benchmark unchanged within noise.","timestamp":1778878917725,"segment":0,"confidence":19.238302502720376,"asi":{"hypothesis":"frame/nat_compat.rs has pure migration conversion logic with only two tests; expanding conversion and priority coverage improves confidence without affecting VarInt/Codec runtime benchmark.","tests_added":6,"files_modified":["src/frame/nat_compat.rs"],"coverage_gap":"frame/nat_compat.rs went from 2 to 8 tests, covering mode defaults, PunchMeNow/RemoveAddress conversions, frame format detection, default priority, and IPv6 priority classes."}}
{"run":44,"commit":"e36e691","metric":0.468115,"metrics":{},"status":"keep","description":"Added 6 port predictor unit tests covering default config, duplicate-port deduplication, max-sample eviction, timestamp-based ordering, per-IP clear behavior, and wrapping delta predictions. Tests only; benchmark unchanged within noise.","timestamp":1778879169024,"segment":0,"confidence":20.717131474103596,"asi":{"hypothesis":"connection/port_prediction.rs has deterministic NAT port prediction logic with only four tests; adding history-management and edge-case coverage improves confidence without affecting VarInt/Codec runtime benchmark.","tests_added":6,"files_modified":["src/connection/port_prediction.rs"],"coverage_gap":"connection/port_prediction.rs went from 4 to 10 tests, covering config defaults, duplicate handling, max_samples eviction, time ordering, clear isolation, and wrapping arithmetic."}}
{"run":45,"commit":"87767f4","metric":0.465135,"metrics":{},"status":"keep","description":"Added 4 incoming connection unit tests covering consumed-state accessor defaults, accept error behavior, refuse/ignore no-op behavior, and RetryError display/roundtrip. Tests only; benchmark unchanged within noise.","timestamp":1778879499353,"segment":0,"confidence":22.385414028868055,"asi":{"hypothesis":"high_level/incoming.rs has consumed-state and error-handling behavior with only one test; adding safe-default and error-path coverage improves confidence without affecting VarInt/Codec runtime benchmark.","tests_added":4,"files_modified":["src/high_level/incoming.rs"],"coverage_gap":"high_level/incoming.rs went from 1 to 5 tests, covering consumed accessors, accept error, refuse/ignore no-ops, and RetryError conversion/display."}}
{"run":46,"commit":"0f720bf","metric":0,"metrics":{},"status":"discard","description":"Close-down verification: confirmed workspace compiles clean (cargo check --workspace --all-targets). Autoresearch work already fully committed and pushed — working tree clean, branch up to date with origin. 376+ unit tests across 9+ modules committed via chore(autoresearch) commits. No code changes this iteration.","timestamp":1783324267347,"segment":0,"confidence":22.385414028868055,"asi":{"hypothesis":"Verify committed autoresearch work is sound before closing session","session_state":"all autoresearch test work + artifacts (autoresearch.ideas.md, autoresearch.jsonl, autoresearch/bench.sh) committed and pushed; working tree clean; branch fix/rustsec-2026-0190-and-quinn-proto-dos up to date with origin","action":"close_down_autoresearch","total_tests_added":376,"modules_covered":9}}
