{"run":47,"commit":"0f720bf1","metric":0.4477,"metrics":{"min":0.4440,"max":0.4546,"stdev":0.0060,"spread":0.0106,"cv_pct":1.3},"status":"discard","description":"Null control (3 back-to-back bench runs, zero code changes): mean=0.4477ns CV=1.3% spread=0.0106ns. Benchmark is saturated at hardware floor — from_u32 is a single inlined MOV (thin LTO), compare is a single CMP. No legitimate optimization available. Prior 45 runs' metric swings were noise. Recorded saturation finding in autoresearch.ideas.md.","timestamp":1783324267347,"segment":0,"confidence":null,"asi":{"hypothesis":"roundtrip_mean_ns is saturated; null control quantifies noise floor","evidence":"3 samples 0.4546/0.4445/0.4440 ns, CV 1.3%, spread 0.0106ns — noise dominates","conclusion":"benchmark at hardware floor; do not chase. Any improvement would require cheating (remove black_box / constant-fold). Recommend switching metric to something with headroom (encode/decode throughput, punch success rate)","action":"close_down_autoresearch","files_modified":["autoresearch.ideas.md"]}}
